{
  "name": "household-shopping",
  "version": "0.1.0",
  "author": "lifeos-community",
  "description": "household shopping state transitions and event publishers",
  "permissions": {
    "graph": ["read"],
    "network": [],
    "voice": [],
    "events": [
      "subscribe:lifeos.household.shopping.item.add.requested",
      "publish:lifeos.household.shopping.item.added",
      "publish:lifeos.household.shopping.item.purchased"
    ]
  },
  "resources": {
    "cpu": "low",
    "memory": "low"
  },
  "requires": ["@lifeos/cli@>=0.1.0 <0.2.0", "@lifeos/module-sdk@>=0.1.0 <0.2.0"],
  "category": "household",
  "tags": ["household", "shopping", "lists"]
}
