{
  "name": "economics-lite",
  "version": "0.1.0",
  "author": "lifeos-core",
  "description": "Lightweight economics and budget tracking module",
  "permissions": {
    "graph": ["read", "append"],
    "network": [],
    "voice": [],
    "events": ["subscribe:lifeos.tick", "publish:lifeos.economics.update"]
  },
  "resources": {
    "cpu": "low",
    "memory": "low"
  },
  "requires": ["@lifeos/life-graph@>=0.3.0 <0.4.0", "@lifeos/event-bus@>=0.3.0 <0.4.0"],
  "category": "finance",
  "tags": ["economics", "budget"]
}
