{
  "name": "household-chores",
  "version": "0.1.0",
  "author": "lifeos-community",
  "description": "household chore recurrence, assignment, and streak helpers",
  "permissions": {
    "graph": ["read"],
    "network": [],
    "voice": [],
    "events": [
      "subscribe:lifeos.household.chore.create.requested",
      "publish:lifeos.household.chore.assigned",
      "publish:lifeos.household.chore.completed",
      "publish:lifeos.household.reminder.fired"
    ]
  },
  "resources": {
    "cpu": "low",
    "memory": "low"
  },
  "requires": ["@lifeos/cli@>=0.1.0 <0.2.0", "@lifeos/module-sdk@>=0.1.0 <0.2.0"],
  "category": "household",
  "tags": ["household", "chores", "recurrence", "streaks"]
}
