{
  "name": "weather",
  "version": "0.1.0",
  "author": "lifeos-core",
  "description": "Weather snapshots with offline cache fallback",
  "permissions": {
    "graph": ["read", "append"],
    "network": ["weather"],
    "voice": ["speak"],
    "events": ["subscribe:lifeos.voice.intent.weather", "publish:lifeos.weather.snapshot.captured"]
  },
  "resources": {
    "cpu": "low",
    "memory": "low"
  },
  "requires": ["@lifeos/life-graph@>=0.3.0 <0.4.0", "@lifeos/event-bus@>=0.3.0 <0.4.0"],
  "category": "utilities",
  "tags": ["weather", "forecast"]
}
